ut,title,year,sport,population,technology,outcome
WOS:000326266100035,Sports technology education at Mid Sweden University,2013,None,Students,"[""None""]","Teaching Ability, Knowledge Level, Precision, Skill, Tactics, Competition"
WOS:000371807800092,The Influence that Sports Information Technology Had on Modern Competitive Sports,2015,None,Players,"[""None""]","Performance, Competition, Tactical Behaviour"
WOS:000394391900102,The Influence that Sports Information Technology had on Modern Competitive Sports,2011,None,Players,"[""None""]","Performance, Competition, Tactical Behaviour, Performance, Injury Incidence"
WOS:000288192800071,The Application of Information Technology in Sports,2010,None,Recreational,"[""Information Technology""]","Competition, Performance, Strategy"
WOS:000390832500005,INNOVATIVE SPORT TECHNOLOGY THROUGH CROSS-DISCIPLINARY RESEARCH: FUTURE OF SPORT SCIENCE,2016,None,Elite,"[""None""]","Injury Prevention, Injury Risk, Competition, Performance, Strategy"
WOS:000555698100002,Sport technology consumers Segmenting users of sports wearable devices based on technology readiness,2019,None,Adults,"[""None""]","Performance, Motivation, User Profiles"
WOS:000310173400119,Measure of Contribution Rate of Science and Technology for the Development of Sports Industry in China's Sports System,2012,None,Adults,"[""None""]","Performance, Technology Innovation, Strategy, Competition"
WOS:000273675800013,Sample Analysis of Artificial Intelligence and Modern Sports Education Technology,2009,None,None,"[""Artificial Intelligence""]","Performance, Technology, Knowledge Level"
WOS:000409403500009,"Sport activity - Systematic Approach to Science, Technology and Art Part Two: Engineering Technology and Sport",2009,None,Athletes,"[""None""]","Performance, Speed, Competition, Strategy, Tactical Behaviour"
WOS:000284087200100,Evaluation Dimensions on Adopting and Banning of Sports Technology,2010,None,Adults,"[""None""]","Performance, Strategy, Competition"
WOS:000389384000059,Application of Computer Technology in Sports Training and Competition,2016,None,Players,"[""None""]","Performance, Competition, Training Ability"
WOS:000352945200022,Sports 3D Simulation Technology and Its Application in Minority Sports Popularization,2015,None,Athletes,"[""Computer Vision"", ""Simulation""]","Injury Incidence, 3D Motion Parameters, Performance"
WOS:000405302500299,Research on Applications of Information Technology in Sport Training,2016,None,Athletes,"[""None""]","Performance, Training Ability"
WOS:000359721400074,Application of Virtual Reality Technology to Sports,2015,None,None,"[""Virtual Reality""]","Performance, Competition, Interaction, Multi-sensory"
WOS:000380441700202,Research on Application of Computer Virtual Reality Technology in College Sports Training,2015,None,College,"[""Virtual Reality""]","Performance, Training, Technical Content, Effectiveness"
WOS:000896308400001,A Narrative Review of the Link between Sport and Technology,2022,None,Athletes,"[""GPS"", ""Virtual Reality"", ""Video Analysis""]","Performance, Psychology, Biomechanics, Injury Management"
WOS:000826445400009,The impact of technology on sports - A prospective study,2022,None,Athletes,"[""None""]","Performance, Performance improvements, Decision-Making"
WOS:000451521400037,Research on Application of Information Technology in Sports Training,2017,None,Adults,"[""None""]","Performance, Teaching Ability"
WOS:000457643100006,Consumer acceptance of sports wearable technology: the role of technology readiness,2019,None,Adults,"[""Wearables""]","Performance, Intention to use sports wearable devices, Psychological processes"
WOS:000359861800048,The Application of Computer Technology in Sports Training,2015,None,Players,"[""None""]","Performance, Training Ability, Knowledge Level"
WOS:000310547200091,Information Technology and Its Application in Sports Science,2012,None,None,"[""Information Technology""]","Performance, Teaching Ability"
WOS:000327941200077,Research on the Application of Information Technology in School Sports,2013,None,School,"[""None""]","Performance, Teaching Ability"
WOS:000751404500001,"An acceptance model for sports technologies: the effects of sports motivation, sports type and context-aware characteristics",2022,None,Adults,"[""None""]","Performance, Motivation, Technology Acceptance, Intention to Use"
WOS:001172386800001,"The ""Clockwork"" Model for Deployment Technology Innovations in Sports Industry Ecosystem: Holistic Approach",2024,None,Elite,"[""None""]","Performance, Technology Deployment, Innovation, Tactical Behaviour"
WOS:000310339200211,Digital Technology in the Application of Sports Fields,2012,None,Professional,"[""None""]","Performance, Teaching Ability, Performance"
WOS:000328521200022,The Application of Sensor Technology in Sports Field,2013,None,Athletes,"[""Sensor Technology""]","Injury Incidence, Performance, Recovery"
WOS:000467966400083,Sport and Modern Technologies,2018,None,Athletes,"[""ACCUPOWER""]","Biomechanics, Injury Risk, Performance, Measurement, Gait Analysis, Ergonomic Evaluation, Ground Reaction Forces"
WOS:000848100000003,Using Mobile Technology in an Adventure Sport,2018,None,Recreational,"[""Mobile Technology""]","Performance, Injury Risk, Recovery"
WOS:000327396400300,Researches of College Sports Technology Teaching Evaluation Methods,2013,None,Collegiate,"[""None""]","Performance, Knowledge Level, Teaching Ability"
WOS:000416078800084,The Innovation of Information Technology in the Development of Chinese Sports Science,2017,None,Sports,"[""None""]","Competitive Sports, Performance, Strategy, Tactics, Knowledge Level, Teaching Ability"
WOS:000589188300129,A Survey of Motion Capture Technology and Its Application in Sports,2019,None,Physical education,"[""Motion Capture"", ""Virtual Reality""]","Performance, Teaching Ability, Knowledge Level"
WOS:000416082100002,Application Analysis of The Data Visualization Technology in Sports Equipment,2017,None,Recreational,"[""Data Visualization""]","Data Visualization, Performance, Fitness"
WOS:000314346403127,Research on Application of Virtual Reality Technology in Competitive Sports,2012,None,Competitive Sports,"[""Virtual Reality""]","Performance, Competition, Tactical Behaviour"
WOS:000566792700016,INTERACTIVE TECHNOLOGIES IN WORKING WITH SPORTS-GIFTED STUDENTS,2020,None,Students,"[""MENTIMETER"", ""KAHOOT"", ""DEBATE"", ""Critical Thinking Development Technology""]","Performance, Teaching Ability, Knowledge Level, Competition"
WOS:000366872700156,The Changing Shape of Sport through Information Technologies,2015,None,Professional players and coaches,"[""GPS""]","Injury Risk, Workload, Performance, Spectator"
WOS:000284085600031,The Exploration of Application of Sports Technology Simulation from Finite Element Analysis,2010,None,Elite,"[""Simulation"", ""Finite Element Analysis""]","Performance, Simulation, Technology, Strategy"
WOS:000555751800006,Sport content and virtual reality technology acceptance,2020,None,Adults,"[""Virtual Reality""]","Performance, Flow, Content Quality, Motivation, Behavioural Intention"
WOS:000259592000059,Study on System Simulation Technology of Movement Combination of Sports Aerobics,2008,None,Recreational,"[""Simulation"", ""Virtual Reality""]","Performance, Tactics, Strategy, Competition"
WOS:000303363500198,The Influence of Modern Science and Technology on Athletic Sport,2011,None,Athletes,"[""None""]","Injury Incidence, Injury Risk, Competition, Injury Prevention"
WOS:000216953600005,Technology of practical realization of system of psychology-pedagogical support of sports activity of swimmers in Paralympics sports,2009,Swimming,Para-Athletes,"[""None""]","Performance, Psychology, Injury Risk, Performance, Physiology"
WOS:000381172301111,Examining the Perceptions of Information Technology in an Elite Sporting Organization,2016,None,Elite,"[""None""]","Performance, Perception, Knowledge Level, Strategy, Competition"
WOS:000349668903046,The application of computer drawing technology in sport drawing,2014,None,Students,"[""None""]","Teaching Ability, Knowledge Level, Precision, Skill, Tactics"
WOS:000262705100224,BIOMECHANICAL TECHNOLOGIES IN CONTEMPORARY SPORT,2008,None,Athletes,"[""None""]","Performance, Biomechanics, Fatigue, Performance"
WOS:000996505500013,Optimising sports marketing strategy by the internet of things and blockchain technology,2023,None,None,"[""Internet of Things"", ""Blockchain""]","Performance, Strategy, Tactics"
WOS:000252145800005,Sports technology in the field of Sports Medicine,2008,None,Athletes,"[""None""]","Performance, Injury Prevention, Competition"
WOS:000343700200029,Computer technology application in the sports field in the context of information,2014,None,College,"[""None""]","Performance, Competition, Knowledge Level"
WOS:000327940500074,Analysis of IT Applications in Sport,2013,None,Students,"[""None""]","Performance, Motivation, Teaching Ability, Knowledge Level, Precision, Skill, Tactics, Competition"
WOS:000319283600084,Application of Computer Virtual Reality Technology in Modern Sports,2013,None,Athletes,"[""Virtual Reality""]","Performance, Training, Competition"
WOS:000298855300091,The Research on Application of Information Technology in sports Stadiums,2011,None,Students,"[""Decision Support Systems""]","Tactical Behaviour, Decision-Making, Strategy, Competition"
WOS:000359861800188,Virtual Motion capture technology Applied In assist-training system of Sports,2015,None,Sports,"[""Simulation""]","Performance, Training, Knowledge Level"
WOS:001000118200001,Application of virtual simulation technology in sports decision training: a systematic review,2023,None,Athletes,"[""Virtual Reality"", ""Simulation""]","Performance, Decision-Making, Sports Decision-Making, Sports Practice"
WOS:000371522300005,Exploration of the Application of Virtual Reality Technology on Sports Simulation Training,2015,None,Players,"[""Virtual Reality"", ""Simulation""]","Performance, Competition, Training"
WOS:000178292200003,Advances in the application of information technology to sport performance,2002,None,Athletes,"[""None""]","Performance, Skill, Training"
WOS:000361639000001,The controversy of sports technology: a systematic review,2015,Golf,Athletics,"[""None""]","Injury Incidence, Performance, Competition, Knowledge Level"
WOS:001173564800004,Exploring technology acceptance patterns of users of the mixed-reality sport technology Zwift: antecedents and consequences of technology acceptance,2025,None,Recreational,"[""None""]","Behavioural intention, Motivation, Autonomy, Psychological Need"
WOS:000781356300001,Assessing the Intention to Use Sports Bracelets Among Chinese University Students: An Extension of Technology Acceptance Model With Sports Motivation,2022,None,University Students,"[""None""]","Performance, Motivation, Intention to use, Intention to use"
WOS:000919934900001,Examining the use of fitness apps in sports centers in Taiwan: incorporating task-technology fit into a technology readiness acceptance model,2023,None,Adults,"[""None""]","Performance, Motivation, Fitness"
WOS:000595736100019,Technology and sport for health promotion: A bibliometric analysis,2020,None,Adults,"[""None""]","Performance, Physiology, Injury Incidence, Recovery, Competition"
WOS:000394391900036,On the Application of Multimedia Technology in Sports History Teaching,2011,None,Students,"[""Multimedia Technology""]","Performance, Motivation, Teaching Ability, Knowledge Level, Precision, Skill, Tactics, Competition, Performance"
WOS:000419038800001,How Sports Can Create New Knowledge at a Technical University that Claim not Doing Research in Sport Science?,2016,None,Athletes,"[""None""]","Performance, Research"
WOS:000308334100072,The Role and Application of Information Technology in Physical Education Teaching and Sports Training,2012,None,University Sports,"[""None""]","Teaching Ability, Knowledge Level, Strategy, Competition"
WOS:000442086100004,The global and the local in sports technology,2010,None,None,"[""None""]","Tactical Behaviour, Motivation, Perception, Decision-Making"
WOS:000680415700024,Emerging Brand Meanings in Wearable Sports Technology: A Case Study on Suunto Sports Watches,2019,None,Female,"[""None""]","Performance, Motivation, Psychological, Well-being, Performance"
WOS:001315135100003,ADVANCING PUBLIC FITNESS AND SPORTS CULTURE: THE ROLE OF DIGITAL SPORTS MUSEUMS LEVERAGING VIRTUAL PRIVATE NETWORK TECHNOLOGY,2024,None,Adults,"[""VPN""]","Performance, Fitness, Motivation, Engagement, Strategy, Competition"
WOS:001129344100001,Sports venue digital twin technology from a spectator virtual visiting perspective,2023,None,Spectators,"[""Digital Twins""]","Performance, Fan Experiences, Engagement, Customer Experiences, Hyper-realistic virtual replicas"
WOS:000469766800027,Review on Wearable Technology Sensors Used in Consumer Sport Applications,2019,None,Recreational,"[""Wearables"", ""GPS"", ""IMU"", ""Sensor Technology""]","Performance, Running Economy, Fitness, Inertial measuring unit, GPS sensors"
WOS:000679398800016,Building a Conceptual Model for Brand Meanings in Wearable Sports Technology,2018,None,Athletes,"[""Technology""]","Brand Meanings, Knowledge Level, Strategy, Competition"
WOS:000292127400003,Analysis on attitudes of physical education and sports academy students to technology,2012,None,Students,"[""None""]","Performance, Attitudes, Technology"
WOS:001087586000005,Leveraging Information Technology for Rapid Product Development in Sports Equipment: A Sport Psychology Perspective,2023,None,Athletes,"[""Data Analytics""]","Performance, Psychological well-being, Motivation, Perception, Decision-Making"
WOS:000312432700110,The application of nano-materials and technologies in sports physical sciences,2012,None,Athletes,"[""Nano-technology""]","Injury Incidence, Injury Risk, Performance, Injury Prevention, Sports Functions Improving"
WOS:000386914200020,Technology for Soccer Sport: The Human Side in the Technical Part,2016,Soccer,Players,"[""None""]","Tactical Behaviour, Performance, Knowledge Level"
WOS:000278523100107,Using Technology in Sport to Support Referee's Decision Making,2009,None,Elite,"[""Decision Support Technology""]","Decision-Making, Performance, Competition, Injury Incidence"
WOS:001301787501080,Sports digitalization - realizing the potential value of tracking technologies in professional sports organizations,2024,Handball,Professional,"[""None""]","Performance, Tactical Behaviour, Knowledge Level, Performance, Information Systems"
WOS:000349617700318,Analysis of the Virtual System of Sports Scene based on Virtual Reality Technology,2014,None,Recreational,"[""Virtual Reality""]","Performance, Competition, Tactics"
WOS:000217044600006,PHYSICAL EDUCATION OF STUDENTS FROM SPORTS-ORIENTED TECHNOLOGIES,2013,None,Students,"[""None""]","Performance, Speed, Injury Incidence, Physical qualities, Endurance, Recovery"
WOS:000977526700001,Role of Technology Innovation in Telemedicine: Focus on Sport Nutrition,2023,None,Athletes,"[""None""]","Performance, Recovery, Performance, Fatigue, Sports, Performance"
WOS:000346143900019,An Application of Multimedia Technology in Sports Education,2013,None,Students,"[""Multimedia Technology""]","Teaching Ability, Knowledge Level, Strategy, Competition"
WOS:000408474200004,"Sport fans in a ""smart sport"" (SS) age: drivers of smartphone use for sport consumption",2017,None,Youth,"[""None""]","Performance, Intention to use, Sport consumption"
WOS:000219684500003,The Global and the Local in Sports Technology,2009,None,None,"[""None""]","Tactical Behaviour, Performance, Perception, Decision-Making"
WOS:000284087000030,Rational Analysis of the Relationship between High Technology and the Alienation of Competitive Sports,2010,Swimming,Elite,"[""None""]","Competition, Injury Risk, Performance, Strategy, Bias"
WOS:000214754200007,Emerging technologies and sports events Innovative information and communication solutions,2015,Football,Players,"[""None""]","Decision-Making, Performance, Injury Risk, Concussion"
WOS:000398981500009,Innovation on multimedia technology software course teaching for sports college,2012,None,College,"[""Multimedia Technology""]","Performance, Motivation, Application Ability, Teaching Ability"
WOS:000294344200007,The use of biomedical technology in sport: Are there any limits?,2010,None,Professional athletes,"[""None""]","Performance, Competition, Strategy, Knowledge Level"
WOS:000380582200016,Application of Holographic Projection Technology in Large-scale Sports Performance Arrangement,2015,None,Players,"[""Holographic Projection""]","Performance, Stage Effect, Tactics, Competition"
WOS:001072074600001,Technology and digital transformation for the structural reform of the sports industry: Building the roadmap,2024,None,Sports organisations,"[""Digital Transformation""]","Digital transformation, Knowledge Level, Technology"
WOS:000371522300188,On the Application of Holographic Projection Technology in the Large - scale Sports Performance Arrangement,2015,None,Players,"[""Holographic Projection""]","Performance, Tactical Behaviour, Competition, Precision, Skill, Tactics"
WOS:001029800300001,Information communication and technology in sports: a meticulous review,2023,Cricket,Elite,"[""Computer Vision"", ""Artificial Intelligence""]","Performance, Tactical Behaviour, Talent Identification, Knowledge Level"
WOS:000259592700079,Engineering Technology for Better Quality of Sports Shoes,2008,None,Athletes,"[""None""]","Performance, Injury Prevention, Biomechanics, Perception, Comfort"
WOS:000780742100001,Sports Information Communication Model Based on Network Technology,2022,None,None,"[""Network Technology""]","Performance, Strategy, Competition"
WOS:000465422000027,Research on the Influence of Internet Technology on Traditional Sports Culture,2018,None,None,"[""Internet Technology""]","Tactical Behaviour, Competition, Knowledge Level"
WOS:001172605800001,Windsurfing's Rapid Global Diffusion: The Evolution of a 1970s Technology-First Sport,2023,None,Recreational,"[""None""]","Performance, Technology-First Sport, Competition, Performance"
WOS:001465402800004,A SYSTEMATIC LITERATURE REVIEW OF BLOCKCHAIN TECHNOLOGY AND THE SPORTS INDUSTRY,2025,None,Players,"[""Blockchain"", ""NFTs""]","Performance, Fan engagement, Stakeholder trust, Strategy, Technology"
WOS:001360811600001,ARTIFICIAL INTELLIGENCE IN SPORTS: A REVOLUTIONARY TECHNOLOGY THAT MUST BE HANDLED WITH CARE,2024,None,Players,"[""Artificial Intelligence""]","Performance, Competition, Strategy, Governance"
WOS:000293198900117,Reasearch on the pattern of cultivating sports Information technology talents in higher vocational colleges of the Pan-Pearl River Delta region,2011,None,Students,"[""None""]","Knowledge Level, Teaching Ability, Competition"
WOS:001089171900001,"A Survey of Evolving Performance Analysis Technologies, Algorithms and Models for Sports",2023,None,Athletes,"[""Artificial Intelligence""]","Performance, Athlete Performance Analysis, Competition, Algorithm Tools, Sports Performance Platforms, Artificial Intelligence"
WOS:000431285600011,Engineering and Technology in Wheelchair Sport,2018,None,Wheelchair athletes,"[""None""]","Performance, Injury Risk, Physiology, Injury Prevention, Running Economy, Fitness, Strategy, Competition"
WOS:000312286500037,Research on the Applications of Information Technology in Sport Management,2012,None,Athletes,"[""Information Technology""]","Performance, Efficiency, Management"
WOS:000406041000120,Sports and Sports Technology as an Enabler of Global Health and Understanding,2016,None,Athletes,"[""None""]","Injury Prevention, Competition, Performance, Motivation, Strategy"
WOS:000613786500001,"Unnatural Technology in a ""Natural"" Practice? Human Nature and Performance-Enhancing Technology in Sport",2019,None,Elite,"[""None""]","Performance, Workload, Fatigue, Competition"
WOS:001217518300001,Sports game teaching and high precision sports training system based on virtual reality technology,2024,None,College Students,"[""Motion Capture"", ""Virtual Reality""]","Performance, Accuracy, Teaching Ability, Knowledge Level, Performance, Precision, Training System"
WOS:000710209500001,From a Technology That Replaces Human Perception-Action to One That Expands It: Some Critiques of Current Technology Use in Sport,2021,None,Players,"[""None""]","Performance, Tactical Behaviour, Knowledge Level, Decision-Making"
WOS:000534845000001,Predicting Sports Injuries with Wearable Technology and Data Analysis,2021,None,Military Personnel,"[""Wearables"", ""Data Analysis""]","Injury Risk, Injury Incidence, Workload, Fatigue, Injury Prevention"
WOS:000434848900009,Presentation of the Extended Technology Acceptance Model in Sports Organizations,2018,None,Employees,"[""None""]","Performance, Intention to use, Motivation, Perceived Usefulness"
WOS:000416083800008,Construction of Maker Multimedia Technology for the Course of Sports Marketing,2017,None,Students,"[""Blockly""]","Innovation Ability, Performance, Teaching Ability, Knowledge Level, Promotion"
WOS:000323185101133,Research On The Contemporary Sports Architecture Creation Of China Under Rational Expression Of Technologies,2013,None,None,"[""None""]","Performance, Injury Incidence, Injury Risk, Performance"
WOS:000667139600002,RETRACTED: Data Mining and Web Technology- Based Sports Development Strategy Analysis (Retracted Article),2023,None,Students,"[""Data Mining"", ""Web Technology""]","Performance, System, Knowledge Level"
WOS:000290460300184,The Optimization of Technology Value Chain in the Large-scale Sports Events,2010,None,None,"[""Value Chain""]","Performance, Strategy, Competition"
WOS:000838065300030,Use of Multimedia Technologies in the Training of Physical Culture and Sports Specialists,2022,None,Students,"[""None""]","Performance, Injury Incidence, Competition, Teaching Ability, Psychological, Motivation"
WOS:000310498800211,The Analysis on Sports Starting Technology Based on Biomechanical Analysis Method,2012,None,Athletes,"[""None""]","Performance, Biomechanics, Physiology, Injury Incidence, Injury Risk, Running Economy, Fatigue, Training Ability"
WOS:000665834200012,MODERN TECHNOLOGIES OF SPORTS AND PATRIOTIC EDUCATION IN CHILDREN AND ADOLESCENTS,2021,None,Adolescents,"[""None""]","Injury Incidence, Motivation, Fitness, Competition, Knowledge Level"
WOS:000404245100214,ADDITIVE TECHNOLOGY IN THE PRODUCTION OF SPORTS NUTRITION SUPPLEMENTS,2017,None,Athletes,"[""None""]","Recovery, Performance, Physiology, Nutrition"
WOS:000602950900001,Disruptive Technologies and the Sport Ecosystem: A Few Ethical Questions,2020,None,Athletes,"[""Artificial Intelligence""]","Performance, Injury Risk, Competition, Tactical Behaviour"
WOS:000405993200174,Research on Sports Action Recognition Based on Somatosensory Technology,2017,None,Players,"[""None""]","Performance, Action Recognition, Tactical Behaviour, Knowledge Level"
WOS:000881662200025,The Technology Adoption Behaviour Model: How Internal and External Factors Affect Technology Adoption Behaviours in Canadian High-Performance Sport Coaching,2022,None,None,"[""None""]",None
WOS:000259593300085,On study of virtual reality technology adopted in sports tourism projects in tourism spots,2008,None,Players,"[""Virtual Reality""]","Performance, Competition, Injury Risk, Motivation, Performance"
WOS:001265574700005,TECHNOLOGICAL STRUCTURE AND CONFIGURATION OF THE USE OF TECHNOLOGY IN EUROPEAN SPORTS ORGANIZATIONS,2024,None,Managers,"[""Data Analysis"", ""Digital Skills"", ""Digital Skills""]","Digital Organizational Culture, Planning Investment Strategies in Digitalization, Training in Digital Skills, Data Analysis, Tactical Technical Physical Performance, Digital Skills"
WOS:000435296700079,The role of science and technology in sport,2018,None,Athletes,"[""Machine Learning"", ""Internet of Things"", ""Data Mining""]","Performance, Data Processing, Technology, Precision"
WOS:001110810900001,Technology Meets Sport Psychology: How Technology and Artificial Intelligence Can Shape the Future of Elite Sport Performance,2024,None,Elite,"[""Data analytics""]","Performance, Prediction, Analytics, Decision-Making"
WOS:000888066600001,"Information technology and its? modernization, the Internet, and sport psychology",2022,None,Adults,"[""Internet""]","Performance, Sport Psychology, Internet, Motivation, Fatigue, Strategy, Competition"
WOS:001378988500001,The impact of sports technology policy in Taiwan: the transformation of relevant organisational and stakeholder relationships,2024,None,Elite,"[""None""]","Performance, Collaboration, Strategy, Knowledge Level"
WOS:000675598100406,Construction of composite mode of sports education professional football teaching based on sports video recognition technology,2020,Football,Professional,"[""None""]","Performance, Accuracy, Performance, Injury Incidence"
WOS:000413260700012,Diagnosis study on sports injuries combined with medical imaging technology,2017,Basketball,Basketball Players,"[""Medical Imaging"", ""X-ray"", ""MRI"", ""CT Imaging""]","Injury Incidence, Injury Prevention, Diagnosis, Performance"
WOS:000795834500001,Mass Diffusion of Modern Digital Technologies as the Main Driver of Change in Sports-Spectating Audiences,2022,None,Adults,"[""None""]","Performance, Psychology, Audience"
WOS:001154630400001,Development of a sports technology quality framework,2023,None,Elite,"[""Data Management""]","Performance, Quality Assurance & Measurement, Accuracy, Repeatability, Reproducibility, Specifications, Quality Assurance & Measurement, Performance"
WOS:001087419500001,Enhancing on-pitch learning capabilities with data analytics and technologies in elite sports,2024,Football,Elite,"[""Data Analytics""]","Performance, Decision-Making, Learning Organisation, Knowledge Level"
