ut,title,year,sport,population,technology,outcome
WOS:000293199600121,Studies On HeBei Traditional Sports Culture Industrialization Development Strategy,2011,None,None,"[""Industrial Technology""]","Injury Prevention, Competition, Strategy, Teaching Ability"
WOS:000813900800003,Health-Care Technology of Badminton Sports Based on Nanotechnology,2022,Badminton,Students,"[""Nanotechnology""]","Injury Incidence, Injury Risk, Performance, Physiology, Fitness, Performance"
WOS:000343700200050,Research on computer aided design of sports actions,2014,None,Coaches,"[""None""]","Tactical Behaviour, Performance, Strategy, Teaching Ability"
WOS:001218617900001,"Microfluidics devices for sports: A review on technology for biomedical application used in fields such as biomedicine, drug encapsulation, preparation of nanoparticles, cell targeting, analysis, diagnosis, and cell culture",2024,None,Athletes,"[""None""]","Injury Prevention, Injury Risk, Injury Incidence, Performance, Recovery, Sport Applications"
WOS:000592698600001,Youth sport 2.0? The development of eSports in Norway from 2016 to 2019,2021,None,Youth,"[""None""]","Competition, Performance, Psychology, Injury Incidence, Acceptance"
WOS:000628666900001,Wearable Sensors in Sports for Persons with Disability: A Systematic Review,2021,None,Para-Athletes,"[""Inertial and EMG sensors""]","Injury Prevention, Performance Characterization for Training Optimization, Athlete Classification, Injury Incidence"
WOS:001345889300001,Strategies for enhancing the value of the sports tourism industry supported by multi-sensor network technology,2025,None,Sports tourists,"[""Multi-sensor Network""]","Tourism, Performance, Planning and Promotion, Strategy, Competition, Knowledge Level"
WOS:001307732800001,Digitalization in action sports: blessing or curse?,2025,None,Athletes,"[""Data and Engagement Platform""]","Performance, Performance Enhancement, Injury Incidence, Value Creation"
WOS:000871909600013,"The Application of Virtual Reality Technology in Sports Psychology: Theory, Practice, and Prospect",2022,Table Tennis,Students,"[""Virtual Reality"", ""VR""]","Performance, Psychology, Teaching Ability, Perception, Knowledge Level"
WOS:001039549500001,Perceptions of paralympic sports in Ecuador,2023,None,Para-Athletes,"[""Technology""]","Injury Incidence, Injury Prevention, Competition, Performance, Strategy"
WOS:000449558300001,The growing threat of cybersecurity attacks in sports,2018,None,Professional,"[""Cybersecurity""]","Cyber Attack, Performance, Data Analytics, Injury Severity"
WOS:000426943700030,The Sports Cultural Analysis of Ancient Chinese Ceramics,2017,None,None,"[""None""]","Performance, Strategy, Competition"
WOS:000359815600022,The Application of High and New Material in Sports,2015,None,None,"[""None""]","Performance, Strategy"
WOS:001126864000002,From data to action: a scoping review of wearable technologies and biomechanical assessments informing injury prevention strategies in sport,2023,None,Players,"[""Force Plates""]","Injury Incidence, Injury Prevention, Player Load, Fatigue, Injury Risk, Performance"
WOS:000409056500004,MODELING IN THE SYSTEM OF ADAPTATION AND SPORT TRAINING MANAGEMENT,2016,None,Elite,"[""None""]","Injury Risk, Performance, Physiology, Recovery, Running Economy, Fatigue, Biomechanics, Psychological, Strategy"
WOS:000253364600011,Terrestrial laser technology in sporting craft 3D modelling,2007,None,Sporting boats' 3D surface modelling,"[""CAD/CAM"", ""CNC machining"", ""Terrestrial Laser Scanner""]","Accuracy, Cost and time effective"
WOS:000426716000171,Discussion on the Influence of Network Sports Information on College Students' Sports Life Style,2017,None,College Students,"[""Network Sports Information""]","Tactical Behaviour, Motivation, Sports Life Style"
WOS:000377852100009,Innovation in the Context of World Sports Development,2016,Athletics,Adults,"[""None""]","Performance, Innovation, Competition"
WOS:001400413300001,SMALL BUSINESSES DRIVING SUSTAINABLE GROWTH IN THE SPORTS INDUSTRY ECONOMY,2025,None,None,"[""ARDL"", ""Digital Technologies""]","Injury Incidence, Carbon Emissions, CO2 Emissions, Performance"
WOS:000769752200001,Research on the Application of CAD Auxiliary Intelligent Technology in Sports,2022,None,Coaches,"[""CAD""]","Performance, Application, Practical Value"
WOS:001093806200001,Simulated Altitude Training and Sport Performance: Protocols and Physiological Effects,2023,None,Athletes,"[""None""]","Performance, Cardiorespiratory Endurance, Power Performance, Physiological Adaptations, Injury Incidence, Recovery, Fatigue, VO2, VE"
WOS:000288192800003,Design and Exploration of Network Courseware on Sports Rehabilitation,2010,None,Recreational,"[""ASP technology"", ""Database""]","Performance, Teaching Ability, Knowledge Level"
WOS:001117729400001,"""Are You Doing Any Sport Science?"" A Brief Editorial",2022,None,Adults,"[""None""]","Injury Risk, Performance, Workload, Fatigue"
WOS:001067627500001,Bibliometric analysis of sport 4.0: a reality for the development of contemporary sports culture,2023,None,Students,"[""Internet of Things"", ""Artificial Intelligence"", ""Big Data""]","Performance, Competition, Strategy, Teaching Ability"
WOS:000339170600083,Investigation and Study on the Status of Public Sport Basketball Selective Course in Jiangxi University of Science and Technology,2013,Basketball,Students,"[""None""]","Tactics, Skills, Knowledge Level, Performance"
WOS:000941790700128,Research on Scientific Sports Training System by Computer Big Data Technology and Intelligent Monitoring,2022,Track and Field,Athletes,"[""None""]","Biomechanics, Performance, Injury Risk, Step Length, Speed, Stride Frequency, Jump Force, Running Economy, Fatigue"
WOS:001338966700128,Web log mining techniques to optimize Apriori association rule algorithm in sports data information management,2024,None,Collegiate,"[""Web Application Development""]","Performance, Retrieval Accuracy, Running Economy"
WOS:000418492600006,"SPORTS JOURNALISM, SUPPORTERS AND NEW TECHNOLOGIES Challenging the usual complicity between media and football institutions",2017,Football,Supporters,"[""Decentralised Media Production Tools""]","Injury Prevention, Performance, Competition, Tactical Behaviour, Psychology, Perception"
WOS:000827551300001,Factors influencing consumer use of a sport-branded app: the technology acceptance model integrating app quality and perceived enjoyment,2023,None,Youth,"[""None""]","Performance, Motivation, Perception, Decision-Making"
WOS:000368429900001,Effect of the Environment on the Sport Performance: Computer Supported Training - A Case Study for Cycling Sports,2015,Cycling,Athletes,"[""None""]","Performance, Physiological, Tactical Behaviour, Workload, Fatigue, Concussion"
WOS:000357966500015,THE CURIOUS CASE FOR MEDIA MONOPOLY IN TECHNOLOGY-DRIVEN SPORTS,2015,None,Elite,"[""None""]","Competition, Performance, Tactics, Strategy, Knowledge Level"
WOS:000209149000003,Determinants of using sports web portals: an empirical examination of the Sport Website Acceptance Model,2012,None,None,"[""None""]","Performance, Competition, Knowledge Level"
WOS:000624704500009,Reaping the digital dividend? Sport marketing's move into esports: insights from Germany,2021,None,Players,"[""None""]","Performance, Digital Marketing, Sponsorship, Marketing Channels, Tactical Behaviour, Competition, Strategy"
WOS:000681302800008,eMuseum of sports: Digital and televised media impact stemming from the virtual galleries and exhibitions,2021,None,Adults,"[""None""]","Performance, Media Coverage, Knowledge Level, Competition"
WOS:000980146500001,Research on the application of marketing strategy of national fitness exercise and dance events in the construction of sports culture based on big data technology,2023,None,Adults,"[""Big Data""]","Performance, Competition, Marketing, Injury Incidence"
WOS:000349448500010,The Ethical Reflection on Nanotechnology Applications in the Field of Sports,2014,None,Sports scientific research,"[""Nanotechnology""]","Injury Incidence, Injury Risk, Performance"
WOS:000771919100080,DIGITAL ECONOMY COMPETENCIES IN THE PHYSICAL EDUCATION AND SPORTS INDUSTRY,2021,None,Students,"[""Digital Marketing""]","Digital Economy, Knowledge Level, Training Ability, Performance"
WOS:000372526800010,Wearable Performance Devices in Sports Medicine,2016,None,Athletes,"[""GPS"", ""Accelerometer"", ""HR"", ""Pedometer""]","Performance, Injury Risk, Training Ability"
WOS:000870003900001,Systematic bibliometric review of sports training management,2023,None,Elite,"[""None""]","Performance, Innovation, Strategy, Competition"
WOS:001336929400003,Utilizing 3D Point Clouds and Deep Learning Technology in Multimedia Instruction for Sports Mechanics,2024,None,Students,"[""Deep Learning""]","Performance, Teaching Ability, Accuracy, Performance"
WOS:000435253700086,A Comparative Study on Preprocessing Methods for Object Tracking in Sports Events,2018,None,Players,"[""Machine Learning""]","Performance, Injury Incidence, Recovery, Tactics, Precision, Skill"
WOS:000349611200296,Analysis of sports architecture technical philosophy characteristics,2014,None,Adults,"[""None""]","Performance, Design Concept, Sustainability"
WOS:001322658600179,Multimodal Sports Interaction: Wearables and HCI in Motion,2024,None,Athletes,"[""Wearables""]","Performance, Injury Risk, Tactical Behaviour, Motivation, Performance"
WOS:000342470700072,"The Researches on ""Sports and Education Combined"" Competitive Sport Backup Talents Training Mode",2012,None,Youth,"[""None""]","Injury Prevention, Competition, Teaching Ability, Knowledge Level, Strategy, Tactics"
WOS:000507127400001,Managing technological innovation in the sports industry: a challenge for retail management,2019,None,Youth,"[""None""]","Performance, Tactical Behaviour, Psychology, Motivation, Competition"
WOS:000303072600027,Computer Applications in Modern Sports,2011,None,None,"[""None""]","Performance, Strategy"
WOS:000216937600045,"Substantiation of Structure and Contents of ""Informatics and Information Technologies in Physical Education and Sports"" Subject in System of Higher Education in Physical Culture",2007,None,Students,"[""None""]","Knowledge Level, Teaching Ability, Automation, Assessment of Success"
WOS:000356136700036,"A Study on Current Status, Problems and Countermeasures of Sunshine Sports - Based on Questionnaire Survey in Tianjin University of Technology and Education",2014,None,Students,"[""None""]","Injury Incidence, Injury Prevention, Performance, Motivation, Fatigue"
WOS:000310173400019,The Ethical Implications of Green Sports in the Perspective of Ecological Civilization,2012,None,Adults,"[""None""]","Performance, Competition, Strategy, Ecological Consciousness"
WOS:000371807800495,Study on Orienteering in the View of Ecological Sports,2015,None,Recreational,"[""Green Technology""]","Injury Prevention, Teaching Ability, Knowledge Level"
WOS:000394484000084,Toward the Construction of a Theoretical Framework for Developing China into a Strong Sports Country,2012,None,Youth,"[""Sports Science and Technology""]","Performance, Competition, Sports Culture, Strength"
WOS:000626372900001,The challenge of regulating doping and non-doping 'performance-enhancing strategies' in elite sports,2021,None,Elite,"[""None""]","Performance-Enhancing Strategies, Injury Risk, Physiology, Performance"
WOS:000441088400014,SURFACE ELECTROMYOGRAPHY AND MUSCLE TESTING TECHNOLOGY FOR TREATMENT OF SHOULDER JOINT SPORTS INJURY,2018,None,Athletes,"[""Surface Electromyography"", ""EMG""]","Injury Incidence, Injury Severity, Injury Prevention, Diagnosis"
WOS:000880499600002,Cutting-edge approaches and innovations in sports rehabilitation training: Effectiveness of new technology,2023,None,Students,"[""Gross simulator"", ""Robotic systems""]","Student Motivation, Injury Prevention, Teaching Ability"
WOS:000273675800030,Construction of Information System for Project Management in Major Sports Games,2009,None,Adults,"[""Project Management""]","Performance, Decision-Making, Strategy, Competition"
WOS:000821848600003,Practicability of Sports Goods in the Sports Field Based on Artificial Intelligence Technology,2022,None,Adults,"[""Artificial Intelligence""]","Performance, Running Economy, Injury Incidence, Decision-Making, Performance"
WOS:001289563800006,Health Evaluation Index of Basketball in modern sports,2024,Basketball,Players,"[""None""]","Performance, Injury Risk, Fitness, Workload, Fatigue"
WOS:000266584200010,MORPHOFUNCTIONAL AND PEDAGOGICAL PARAMETERS OF BOXERS' SPORTS PERSPECTIVE ON THE STAGE OF SPORTS PERFECTION,2009,Boxing,Elite,"[""None""]","Performance, Sports Perspective, Injury Risk, Performance, Sports Perspective"
WOS:000183500600001,"The technologies of the self: Sport, feminism, and Foucault",2003,None,Adults,"[""None""]","Performance, Psychology, Power"
WOS:000391644200074,Application of Information Technology in Athletics Teaching in University,2016,Track and Field,Students,"[""None""]","Performance, Motivation, Learning"
WOS:000581697300002,Research on sports fitness management based on blockchain and Internet of Things,2020,None,Athletes,"[""Internet of Things""]","Performance, Data Management, Fitness, Recovery, Data Management"
WOS:000240892900006,"Manual wheelchairs: Research and innovation in rehabilitation, sports, daily life and health",2006,None,Adults,"[""None""]","Injury Risk, Workload, Fatigue, Injury Incidence, Performance"
WOS:001222082600005,Concurrent-Validity and Reliability of Photocells in Sport: A Systematic Review,2024,Track and Field,Athletes,"[""None""]","Performance, Injury Incidence, Accuracy, Measurement, Precision"
WOS:000397384100030,An insight into the use and assessment of lower limb running prostheses in sport with a disability: A mixed method approach,2016,None,Below-knee amputees,"[""None""]","Performance, Injury Risk, Competition, Recovery, Assessment Strategy"
WOS:000440938600006,"Sports, storytelling and social media: a review and conceptualization",2018,None,Professional,"[""Social Media""]","Performance, Tactics, Strategy, Management"
WOS:001167649700001,Edge Computing-Based Athletic Ability Testing for Sports,2024,Swimming,Professional,"[""Edge Computing""]","Performance, Injury Incidence, Performance, Accuracy, Performance"
WOS:000380576500056,Design and Implement of PE Network Education Platform Facing to Network Sports Teaching Resources,2015,None,Students,"[""Web technology"", ""streaming media technology"", ""database"", ""electronic white board""]","Teaching Ability, Knowledge Level, Real-time interactive"
WOS:000886615200011,New Metaphorical Models in Modern Sports Discourse,2022,None,None,"[""None""]","Performance, Psychology, Perception, Knowledge Level, Tactics"
WOS:000345562000021,TV Transmission of Ecological Sports and Ecological Development of TV Programme,2013,None,Adults,"[""None""]","Injury Incidence, Injury Risk, Performance, Competition, Strategy"
WOS:000651641700010,"Participation in pre-injury level sport one-year following sport-related concussion: A prospective, matched cohort study",2021,None,Amateur Athletes,"[""None""]","Injury Incidence, Performance, Competition, Psychological, Recovery"
WOS:000439263500001,The Introduction and Application of Sports Analytics in Professional Sport Organizations A Case Study of the Tampa Bay Lightning,2014,Ice Hockey,Professional,"[""CRM""]","Performance, Strategy, Revenue"
WOS:000746548900009,PROPOSAL FOR A COMPREHENSIVE COMMUNICATION PLAN IN SPORTS MANAGEMENT,2021,None,None,"[""Communication""]",None
WOS:001484225300001,Towards an immersive experience in tactical sports: A systematic review and future directions for airsoft and paintball,2025,None,Recreational,"[""GPS"", ""IoT"", ""Augmented Reality""]","Tactical Behaviour, Competition, Motivation, Performance, Strategy, Performance"
WOS:000635166900018,THE USE OF ARTIFICIAL INTELLIGENCE IN SPORTS AND ITS LEGAL LIMITATIONS,2020,None,None,"[""Artificial Intelligence"", ""Drones""]","Performance, Competition, Tactical Behaviour, Legal Limitations"
WOS:000364788100052,The Research of Sports Digital Training System,2015,None,None,"[""Virtual Reality""]","Performance, Strategy, Competition"
WOS:000216930200020,Technology of Perfection of Management of Controls of Physical Training and Sports,2006,None,Adults,"[""None""]","Performance, Knowledge Level"
WOS:000245922800001,"Flopping, mapping and gene doping: Dichotomies between 'natural' and 'artificial' in elite sport",2007,None,Elite,"[""None""]","Performance, Competition, Psychological, Perception, Strategy, Injury Risk"
WOS:000495556300001,State-of-the-art review of athletic wearable technology: What 113 strength and conditioning coaches and athletic trainers from the USA said about technology in sports,2020,None,Elite,"[""Wearables""]","Injury Incidence, Performance, Injury Prevention, Baselining movement and injury mitigation, Quantification of performance"
WOS:000399131600009,The Influence of Audiovisual Sports Advertising in Sedentary Individuals,2016,None,Sedentary Individuals,"[""None""]","Performance, Motivation, Perception, Injury Incidence, Psychology"
WOS:000569778100001,Solar Ultraviolet Exposure in Individuals Who Perform Outdoor Sport Activities,2020,None,Adults,"[""Mobile Technologies""]","Injury Risk, Performance, Skin Cancer, Risk Mitigation"
WOS:000611568100001,"The Moral Gatekeeper: Soccer and Technology, the Case of Video Assistant Referee (VAR)",2021,Soccer,Professional,"[""None""]","Performance, Injury Incidence, Competition, Performance, Knowledge Level"
WOS:000367003800006,Two norms for innovation in outdoor sports: Technical and social innovation,2015,None,Players,"[""None""]","Injury Prevention, Involvement of the players, Motivation, Tactical Behaviour"
WOS:001451807600001,Enhancing sport sales training through technology: an examination of artificial intelligence as a tool for evaluating and training sales agents,2025,Basketball,Players,"[""Machine Learning"", ""Artificial Intelligence""]","Performance, Sales, Feedback, Decision-Making"
WOS:000417676000016,Textile Integrated Wearable Technologies for Sports and Medical Applications,2017,None,Adults,"[""Textile Integrated Wearable Devices""]","Performance, Physiology, Recovery, Fitness, Running Economy, Endurance, Competition"
WOS:000288192800015,The Path of Innovation for Competitive Advantages of Competitive Sports in Jiangsu Province,2010,None,Competitive Sports,"[""Sports Management System""]","Performance, Innovation, Project Management"
WOS:000343700200030,The application of service science in sports field,2014,None,College,"[""None""]","Teaching Ability, Knowledge Level"
WOS:000349611200295,Analysis of China Ancient and Modern Sports Architecture,2014,None,None,"[""None""]","Performance, Competition"
WOS:000422587100007,Sport Tourism Centres from Top Athletes' Perspective: Differences among Sport Groups,2014,None,Elite,"[""None""]","Performance, Injury Incidence, Tactical Behaviour, Competition, Sport Tourism"
WOS:001204735600001,Wearable device for continuous sweat lactate monitoring in sports: a narrative review,2024,None,Athletes,"[""None""]","Performance, Injury Risk, Physiology, Fatigue, Endurance, Running Economy, Sweat, Performance"
WOS:000371522300354,Research on Sports Demonstration Teaching System Based on Kinect,2015,None,Adults,"[""Kinect""]","Performance, Motivation, Teaching Ability"
WOS:000410619600007,Twitter as Disruptive Innovation in Sport Communication,2014,None,None,"[""Social Media""]","Performance, Knowledge Level, Strategy, Competition"
WOS:001279270800001,Animated VR and 360-degree VR to assess and train team sports decision-making: a scoping review,2024,None,Elite,"[""VR"", ""Motion Capture"", ""Virtual Reality""]","Performance, Decision-Making, Injury Incidence, Psychological, Perception, Biomechanics"
WOS:001469486900002,Development of a Sports Training Program Planning Information System (SIPRENPOL),2025,None,Students,"[""Information Technology""]","Planning Efficiency, Knowledge Level, Teaching Ability, Training Efficacy"
WOS:000438848100035,Assessment Of The Quality Of Paralympic Sports In Sports Clubs For Disabled People In Russia,2018,None,Para-Athletes,"[""None""]","Injury Incidence, Competition, Injury Prevention, Recovery, Knowledge Level, Training Ability"
WOS:000386451200004,Rejecting Technology: A Normative Defense of Fallible Officiating,2016,None,None,"[""None""]","Injury Incidence, Decision-Making, Competition"
WOS:001095389700001,Artificial Intelligence Program for Predicting Wrestlers' Sports Performances,2023,Wrestling,Youth,"[""Artificial Intelligence"", ""Machine Learning""]","Performance, Prediction, Training Ability"
WOS:001098106100001,Sport entrepreneurship: the role of innovation and creativity in sport management,2024,None,Elite,"[""None""]","Performance, Innovation, Creativity, Research, Knowledge Level"
WOS:000387454000150,Computational Design for Sport Buildings,2016,None,Elite,"[""Simulation""]","Performance, Design Optimization, Simulation, Strategy"
WOS:000216934800042,DATAWARE SYSTEM FOR PROFESSIONAL TRAINING OF FUTURE SPECIALISTS IN PHYSICAL EDUCATION AND SPORTS,2007,None,Professional,"[""Dataware""]","Performance, Knowledge Level, Teaching Ability"
WOS:000541125000013,RETRACTED: Study on Sports Volleyball Tracking Technology Based on Image Processing and 3D Space Matching (Retracted Article),2020,Volleyball,Professional,"[""Simulation""]","Performance, Accuracy, Injury Incidence, Running Economy, Performance, Performance"
WOS:000851606300001,Sport diplomacy: an integrative review,2023,None,None,"[""None""]","Performance, Competition, Strategy, Knowledge Level"
WOS:000768229100001,"Competition, Gender Equality, and Doping in Sports in the Red Queen Effect Perspective",2022,None,Elite,"[""None""]","Competition, Performance, Injury Risk, Doping, Performance Enhancement Drugs"
WOS:000474733300061,Ground Sports Strategy Formulation and Assistance Technology Develpoment: Player Data Acquisition from Drone Videos,2019,None,Players,"[""None""]","Performance, Tactical Behaviour, Player Detection, Player Tracking, Movement Trajectory"
WOS:000680729100005,Wearable and telemedicine innovations for Olympic events and elite sport,2021,None,Elite,"[""None""]","Physiology, Injury Incidence, Recovery, Performance, Workload, Fatigue"
WOS:001199449109118,MMSports'23: 6th InternationalWorkshop on Multimedia Content Analysis in Sports,2023,None,Recreational,"[""None""]","Injury Incidence, Injury Risk, Performance, Statistical Analysis"
WOS:000216952600015,Information technologies in professional training of future specialists in physical education and sports in European union,2009,None,Professional,"[""None""]","Performance, Knowledge Level, Teaching Ability"
WOS:001069220200015,SCALABILITY AND SUSTAINABILITY IN THE CONSTRUCTION OF A SOCIAL SPORTS MANAGEMENT INFORMATION PLATFORM BASED ON WEB TECHNOLOGY,2023,None,None,"[""Data Analysis""]","Scalability, Sustainability, Data Analysis, Performance"
WOS:000474859700044,"THE SPORT DETRAINING IN WATER POLO, AN APPROACH FROM SCIENCE, TECHNOLOGY AND SOCIETY STUDIES",2019,None,Water Polo athletes,"[""None""]","Injury Incidence, Injury Prevention, Pathology"
WOS:000403150000177,A Comparative Study on Multi-object Tracking Methods for Sports Events,2017,None,Players,"[""Machine Learning""]","Performance, Injury Incidence, Tactical Behaviour, Decision-Making, Running Economy, Speed"
WOS:000565996000001,Data in Motion: Sports as a site for expansive learning,2020,None,Students,"[""None""]","Performance, Tactical Behaviour, Perception, Engagement"
WOS:000324896700015,Study on Soft Power of Sports Industry in China,2012,None,Adults,"[""None""]","Performance, Competition, Strategy, Knowledge Level"
WOS:001469486900003,Learning sports initiation through CLIL dissemination,2025,None,Students,"[""None""]","Performance, Learning, Knowledge Level, Strategy, Tactical Behaviour"
WOS:000280011600008,Imaging Diagnosis of Sports Injury,2010,None,Adults,"[""Magnetic Resonance Imaging"", ""Computed Tomography"", ""Nuclear Medicine""]","Injury Incidence, Injury Severity, Diagnostic Accuracy"
WOS:000284087200050,A Study on the Constraints of Leisure Sports Participation among Undergraduates,2010,None,Undergraduates,"[""None""]","Injury Incidence, Motivation, Perception, Strategy, Competition"
WOS:000389384000065,Analysis on the Effective Development of Sports Network Educational Resources,2016,None,Students,"[""None""]","Performance, Knowledge Level, Teaching Ability"
WOS:000343757000004,Relationship between Sport and Media-On promoting the sound development of bilateral relations,2013,None,Adults,"[""None""]","Competition, Performance, Strategy, Knowledge Level"
WOS:000447574300002,Fujitsu's Technologies and Solutions Contributing to Development of Sports,2018,None,Players,"[""Digital Sports Services""]","Performance, Tactical Behaviour, Competition"
WOS:000408645400005,Fantasy Sports and Gambling in Sport: Marketing Implications for Branding and Fan Engagement,2016,None,Fans,"[""None""]","Marketing, Fan Engagement, Consumer Behaviour"
WOS:001046403400005,Design of sports multimedia teaching platform based on machine learning,2023,None,College Students,"[""Machine Learning"", ""Multimedia Technology"", ""Network Technology""]","Performance, Knowledge Level, Teaching Ability, Student Satisfaction"
WOS:001185216100002,The Influence of the Green Consumption Concept on the Demand for Mass Sports,2024,None,Adults,"[""None""]","Performance, Injury Incidence, Competition, Motivation, Performance"
WOS:000662085600112,Construction of Chinese Sports Knowledge Graph Based on Neo4j,2020,None,Youth,"[""Artificial Intelligence"", ""Knowledge Graphs"", ""Neo4j""]","Knowledge Level, Accuracy, Efficiency, Query"
WOS:000352704700084,Reflection on the Dissimilation of the Modern Athletic Sports,2015,None,Adults,"[""None""]","Competition, Performance, Strategy, Motivation"
